ITEM_ID,ITEM_NAME,ITEM_DESCRIPTION,BRAND,MANUFACTURER,UOM,ITEM_TYPE,STATUS
ITEM_0165,Similar Good,Piece up though upon discover firm provide blood recently site.,Rice-Woods,Johnson Inc,Piece,SEMI_FINISHED,ACTIVE
ITEM_0166,Usually Into,As sort wind machine fight stay new because son teacher.,Garza-Branch,Johnson-Copeland,Litre,SEMI_FINISHED,ACTIVE
ITEM_0167,Feel Building,Remain usually during debate most item month dream store box something trial tonight black.,Oneill Ltd,Donaldson PLC,Piece,SEMI_FINISHED,ACTIVE
ITEM_0168,About Town,Than city bed tough order size after become produce win ask too use job.,Terry-Powell,White-Jackson,Litre,RAW,DISCONTINUED
ITEM_0169,Generation Much,A nation tax group my a major there.,Gibson-Harris,Carter-Jones,KG,SEMI_FINISHED,ACTIVE
ITEM_0170,Soon Chair,Military suffer item must cold prepare people politics read man.,"Bush, White and Brown","George, Ross and Holmes",Litre,PACKAGED,DISCONTINUED
ITEM_0171,Line Country,Usually spring major amount debate hair interview skill big.,Gonzalez-Hall,"Scott, Spence and Stewart",KG,SEMI_FINISHED,ACTIVE
ITEM_0172,Think Lawyer,Much system chair exist picture through interest much follow project human card.,Burns-Yang,"Miller, Powell and Rangel",Litre,PACKAGED,ACTIVE
ITEM_0173,Administration Draw,Process citizen shake interest drop table gas major century score far could free.,"Garcia, Stone and Ramirez","Cuevas, Ward and Moore",Box,FINISHED,ACTIVE
ITEM_0174,Child According,Strong view stock always defense full political month skin service where lot pass general.,"Carter, Lopez and Wright",Cruz-Ortiz,KG,FINISHED,DISCONTINUED
ITEM_0175,Chance Southern,Thus list perhaps family little too no.,Sawyer-Conway,"Greene, Smith and Koch",Box,SEMI_FINISHED,DISCONTINUED
ITEM_0176,Born Middle,Throughout suffer community customer leave name take activity forward visit hotel evening.,Edwards LLC,Howard Inc,KG,RAW,DISCONTINUED
ITEM_0177,Television This,Far give thus we box cold population professor art how firm less.,Williams-Hansen,Johnson-Blanchard,Litre,RAW,ACTIVE
ITEM_0178,Young Event,Structure test Congress program serious dinner affect decide maybe cold evidence big growth.,"Collins, Wiley and Hopkins",Hart PLC,KG,PACKAGED,DISCONTINUED
ITEM_0179,List Individual,Less defense yeah bed describe cup anyone.,"Rogers, King and Jordan","Rodgers, Lee and Smith",Litre,RAW,ACTIVE
ITEM_0180,Campaign Hand,Talk security out contain agreement central final father something establish assume station ever structure because yet.,Bennett and Sons,"Hernandez, Walker and Lee",Box,FINISHED,DISCONTINUED
ITEM_0181,Manage Determine,American dream mother rate crime stand should ball other real sea bed.,Mcdonald Inc,"Suarez, Cruz and Barrett",KG,PACKAGED,ACTIVE
ITEM_0182,Suggest Need,Long start white player land rest record between go.,"Morgan, Wallace and Hood",Harris-Phillips,KG,PACKAGED,ACTIVE
ITEM_0183,Daughter Foot,Reach lose attack will well bar ever sit yourself look indicate market young feeling recently ahead.,Francis and Sons,Brewer Ltd,KG,SEMI_FINISHED,ACTIVE
ITEM_0184,Special Including,Society action right green center simply size.,Banks-Owens,"Jennings, Lowe and Mccormick",Box,RAW,ACTIVE
ITEM_0185,Few Much,Continue structure middle really thousand hope at size sort computer campaign sport year least daughter.,Hall LLC,Martinez-West,Litre,FINISHED,ACTIVE
ITEM_0186,Question Also,Everyone race probably long deep focus present college indeed seven population business again nation challenge.,Black-Taylor,Smith LLC,KG,FINISHED,ACTIVE
ITEM_0187,Sport Animal,Take hit there series piece prove ability article professor around return wish source matter.,Jackson-Herring,Stewart-Blackburn,KG,RAW,ACTIVE
ITEM_0188,For President,Appear despite body outside lead focus continue.,"Brown, Gilbert and Simon",Hamilton Ltd,Piece,SEMI_FINISHED,ACTIVE
ITEM_0189,Answer Want,Entire main watch cultural imagine program body.,Anderson-Dixon,Johnson-Murphy,Piece,PACKAGED,ACTIVE
ITEM_0190,Speak Lose,Return happen raise player detail region middle.,"Coleman, Morrow and Brown","Allen, Ho and Garrison",Litre,RAW,ACTIVE
ITEM_0191,Country My,Anything management hit offer bag assume occur suggest deal talk cause animal.,Villarreal-Phillips,Shepherd Group,Litre,FINISHED,ACTIVE
ITEM_0192,Ability Site,Hit tough safe conference development manage position industry.,"Robinson, Casey and Dixon",Garrison LLC,Piece,RAW,DISCONTINUED
ITEM_0193,Stay Movie,From suffer good by issue activity result world sea within large land film.,Todd PLC,Hansen PLC,KG,PACKAGED,ACTIVE
ITEM_0194,Matter Anything,Such full difficult town herself but so put arm debate success idea spring dream.,James Inc,Oconnor PLC,Piece,SEMI_FINISHED,ACTIVE
ITEM_0195,Within Describe,With couple remember college impact provide put none less source.,"Allen, Perry and Fowler","Young, Simon and Hudson",Litre,RAW,ACTIVE
ITEM_0196,Who Four,Through note which threat she respond much size here bad quickly such.,Torres Group,"Jones, Garcia and Santos",Litre,RAW,DISCONTINUED
ITEM_0197,By Should,Way still investment friend sometimes able course medical despite.,Smith LLC,"Hawkins, Sanchez and Moore",Litre,PACKAGED,ACTIVE
ITEM_0198,Especially Bank,Stop dog million mean western current as ahead add machine military various than sense.,Watson-Estrada,Hayes-Castillo,Piece,PACKAGED,DISCONTINUED
ITEM_0199,Structure Foreign,Fact player finish happy remember travel likely.,Sanchez-Patel,Mcpherson-Dean,Piece,RAW,DISCONTINUED
